{
  "$schema": "./wire-format.schema.json",
  "title": "bones core message wire format",
  "introduction": "This specification and [extension.wit](extension.wit) are the two halves of the extension ABI: `extension.wit` defines the calls, this defines the bytes those calls carry on core-owned topics. It describes the ABI line of the `abi-v*` tag or release archive you took it from; `bones-messages` carries the same version number.\n\nWritten so an extension author in any language can produce and consume core messages without reading Rust. The Rust implementation lives in `bones-messages`; where the two ever disagree, the [conformance vectors](vectors/README.md) decide, because both this specification and that crate are checked against them.",
  "sections": [
    {
      "heading": "Scope",
      "markdown": "The bus itself is untyped. A payload is a byte string, and an extension may put anything in one for topics it owns — bones neither inspects nor constrains those (ADR-016). What is specified here is only the set of topics bones itself defines, because those are the ones both sides must agree on.\n\nSo there are three kinds of traffic, and only the first is in scope:\n\n- **Core-owned topics** — `core/*`, `input/*`, `gfx/*`, `ui/*`, `audio/*`, `game-core/*`, `web/*`, `renderer/*`, `window/*`, `persistence/*`, `instance/*`, `desktop/*`, `os/*`, `upgrader/*`. Encoded exactly as below.\n- **Direct sends to core endpoints** — `persistence`, `files`, `web`. Their request and reply shapes are in [Direct-send endpoints](#direct-send-endpoints).\n- **Everything else** — opaque application payloads between extensions. Not specified, deliberately."
    },
    {
      "heading": "Versioning",
      "markdown": "This specification carries the **ABI version line**, not the engine's (ADR-029). It moves when the encoding of an existing message changes or a core topic is removed — both of which break every extension built against the previous version — and not when the engine's Rust API changes.\n\nAdding a new core topic does not break a decoder that does not subscribe to it, and adding a new variant to a tagged union does not break a decoder that never receives one. Both are additive and do not force a major bump on their own. Removing or renumbering a tag does.\n\nThere is no version field in a payload. The version is established out of band, by the `bones:extension@<version>` import in the component itself, which the host refuses to instantiate on a mismatch — see [README.md](README.md) for how that check behaves."
    },
    {
      "heading": "Primitives",
      "markdown": "Every multi-byte number is **little-endian**, two's complement where signed. There is no alignment or padding anywhere: a field starts at the byte after the previous field ends.",
      "primitives": [
        { "name": "u8", "size": "1", "encoding": "unsigned byte" },
        { "name": "u16", "size": "2", "encoding": "unsigned, little-endian" },
        { "name": "u32", "size": "4", "encoding": "unsigned, little-endian" },
        { "name": "i32", "size": "4", "encoding": "signed two's complement, little-endian" },
        { "name": "f32", "size": "4", "encoding": "IEEE 754 binary32, little-endian" },
        { "name": "bool", "size": "1", "encoding": "`0` is false; **any non-zero byte is true**. Encoders write `1`" },
        { "name": "str", "size": "2 + n", "encoding": "`u16` byte length, then that many bytes of UTF-8. Not NUL-terminated" },
        { "name": "blob", "size": "4 + n", "encoding": "`u32` byte length, then that many raw bytes" },
        { "name": "rest", "size": "—", "encoding": "every remaining byte of the payload, raw. Only ever the final field" },
        { "name": "str-rest", "size": "—", "encoding": "every remaining byte, as UTF-8. Only ever the final field" }
      ],
      "after_primitives": "`str` and `blob` differ only in the width of their length prefix and whether the content is required to be UTF-8. A field is written as `str`/`blob` rather than `rest` precisely when something follows it.\n\nA length prefix counts **bytes, not characters**. A `str` cannot exceed 65535 bytes and a `blob` cannot exceed 4294967295; an encoder that is handed more must fail rather than truncate."
    },
    {
      "heading": "Framing",
      "markdown": "A payload is the concatenation of its fields, in the order the topic lists them. There is no envelope, no length prefix on the payload as a whole, no type tag, and no field names — the topic determines the shape completely.\n\nThree rules make that unambiguous:\n\n- **Fixed-shape messages must be consumed exactly.** If any byte remains after the last field, the payload is invalid (`trailing-bytes`). Decoders must check this rather than ignore the tail; it is what catches a version skew that happens to parse.\n- **`rest` and `str-rest` may appear only as the final field**, and consume whatever is left, including nothing. A message whose only variable field is last uses `rest`; one with a variable field before another field uses `str` or `blob`.\n- **A tagged union leads with a `u8` tag**, and the fields that follow depend on it. An unrecognised tag is invalid (`invalid-tag`), not skippable — a payload does not carry the length of its own variant, so a decoder that does not know the tag cannot find the end of it.\n\nCounted sequences are a `u16` count followed by that many elements back to back, each encoded as its element shape says. There is no separator and no terminator."
    },
    {
      "heading": "Decoding failures",
      "markdown": "Four failures are distinguishable, and an implementation should report them separately because they mean different things:\n\n| Failure | Meaning |\n| --- | --- |\n| `truncated` | the payload ended before a field could be read in full |\n| `trailing-bytes` | a fixed-shape payload had bytes left after its final field |\n| `invalid-tag` | a tagged union carried a tag the contract does not define |\n| `invalid-utf8` | a `str`, `str-rest`, or string field was not valid UTF-8 |\n\nA malformed payload is dropped by the receiver, not reported back to the sender. The bus is at-most-once and has no negative acknowledgement (ADR-009).\n\nThe extension host checks every core-topic payload an extension publishes against this specification before delivering it. When one fails, it logs a warning naming the extension, the topic, the failure, the payload's length and leading bytes, and this specification's section for the topic. It warns once per extension and topic, so a malformed message published every frame produces one line. The payload is still delivered, and its receiver drops it as above."
    }
  ],
  "groups": [
    {
      "name": "Core topics",
      "entries": [
        {
          "topics": ["core/tick"],
          "description": "Published by the engine each frame to `core/tick` subscribers (ADR-004).",
          "payload": {
            "fields": [
              { "name": "dt", "type": "f32", "meaning": "seconds since the previous tick" }
            ]
          }
        },
        {
          "topics": ["core/lifecycle"],
          "description": "Published by the engine when an extension's state changes.",
          "payload": {
            "fields": [
              {
                "name": "event",
                "type": "u8",
                "meaning": "what happened",
                "values": [
                  { "value": 0, "name": "loaded" },
                  { "value": 1, "name": "faulted" },
                  { "value": 2, "name": "reloading" },
                  { "value": 3, "name": "reloaded" },
                  { "value": 4, "name": "stopped" }
                ]
              },
              { "name": "extension", "type": "str-rest", "meaning": "the extension's host-stamped name" }
            ]
          }
        },
        {
          "topics": ["core/extensions/load", "core/extensions/unload", "core/extensions/reload"],
          "description": "Runtime activation commands (ADR-024), honoured only from the sender the embedder authorised as the extension controller.",
          "payload": {
            "fields": [
              { "name": "extension", "type": "str-rest", "meaning": "catalog name to act on" }
            ]
          },
          "notes": "All three share one shape; the topic is the verb."
        },
        {
          "topics": ["window/close-requested"],
          "payload": { "fields": [] },
          "notes": "The topic is the whole message."
        }
      ]
    },
    {
      "name": "input/*",
      "entries": [
        {
          "topics": ["input/key-down", "input/key-up"],
          "payload": {
            "fields": [
              { "name": "key", "type": "str-rest", "meaning": "key name, e.g. `\"A\"`, `\"Space\"`, `\"Left\"`" }
            ]
          },
          "notes": "`key` is SDL's name for the key, the same on every platform and layout-independent. Letters are upper case, `A` to `Z`, and digits are `0` to `9`. The arrows are `Left`, `Right`, `Up`, and `Down`. Other common names are `Space`, `Return`, `Escape`, `Backspace`, `Tab`, `Left Shift`, `Left Ctrl`, `F1` to `F12`, and `Keypad Enter`."
        },
        {
          "topics": ["input/mouse-down", "input/mouse-up"],
          "payload": {
            "fields": [
              { "name": "button", "type": "u8", "meaning": "platform button index; 1 is left" },
              { "name": "x", "type": "f32", "meaning": "window coordinate" },
              { "name": "y", "type": "f32", "meaning": "window coordinate" }
            ]
          }
        },
        {
          "topics": ["input/mouse-move"],
          "payload": {
            "fields": [
              { "name": "x", "type": "f32", "meaning": "window coordinate" },
              { "name": "y", "type": "f32", "meaning": "window coordinate" },
              { "name": "dx", "type": "f32", "meaning": "movement since the previous event" },